{
  "$schema": "https://json-schema.org/draft/2020-12/schema",
  "type": "array",
  "items": {
    "type": "object",
    "properties": {
      "study_name": {
        "type": "string",
        "description": "Full name of the study"
      },
      "study": {
        "type": "string",
        "description": "Short identifier for the study"
      },
      "study_phs_number": {
        "type": "string",
        "description": "Public Health Service (PHS) number for the study"
      },
      "study_url": {
        "type": "string",
        "format": "uri",
        "description": "URL linking to the study details"
      },
      "form_group": {
        "type": "array",
        "items": {
          "type": "object",
          "properties": {
            "form_group": {
              "type": "string",
              "description": "Name or category of the form group"
            },
            "form": {
              "type": "array",
              "items": {
                "type": "object",
                "properties": {
                  "form": {
                    "type": "string",
                    "description": "Name of the form"
                  },
                  "form_description": {
                    "type": "string",
                    "description": "Description of the form"
                  },
                  "form_name": {
                    "type": "string",
                    "description": "Alternate or display name of the form"
                  },
                  "variable_group": {
                    "type": "array",
                    "items": {
                      "type": "object",
                      "properties": {
                        "variable_group_name": {
                          "type": "string",
                          "description": "Name of the variable group"
                        },
                        "variable_group_description": {
                          "type": "string",
                          "description": "Description of the variable group"
                        },
                        "variable": {
                          "type": "array",
                          "items": {
                            "type": "object",
                            "properties": {
                              "variable_id": {
                                "type": "string",
                                "description": "Unique identifier for the variable"
                              },
                              "variable_name": {
                                "type": "string",
                                "description": "Descriptive name of the variable"
                              },
                              "variable_type": {
                                "type": "string",
                                "enum": ["num", "string", "boolean", "date"],
                                "description": "Data type of the variable"
                              },
                              "variable_description": {
                                "type": ["string", "null"],
                                "description": "Description of what the variable represents"
                              },
                              "data_hierarchy": {
                                "type": "string",
                                "description": "Hierarchical representation of the variable within the dataset"
                              },
                              "drs_uri": {
                                "type": "array",
                                "items": {
                                  "type": "string",
                                  "format": "uri"
                                },
                                "description": "List of Data Retrieval System (DRS) URIs for accessing the variable"
                              },
                              "derived_variable_level_data": {
                                "type": "array",
                                "items": {
                                  "type": "object"
                                },
                                "description": "Derived data associated with the variable"
                              }
                            },
                            "required": [
                              "variable_id",
                              "variable_name",
                              "data_hierarchy"
                            ]
                          }
                        }
                      },
                      "required": [
                        "variable"
                      ]
                    }
                  }
                },
                "required": [
                  "form",
                  "variable_group"
                ]
              }
            }
          },
          "required": ["form_group", "form"]
        }
      }
    },
    "required": ["study_name", "study_phs_number", "form_group"]
  }
}