[{"study_name":"Hematopoietic Cell Transplant for Sickle Cell Disease","study":"HCT for SCD","study_phs_number":"phs002385","study_url":"https://www.ncbi.nlm.nih.gov/projects/gap/cgi-bin/study.cgi?study_id=phs002385.v1.p1","form_group":[{"form_group":"All forms within the study","form":[{"form":"Form Name Not Provided","form_description":"Form Name Not Provided","form_name":"Form Name Not Provided","variable_group":[{"variable_group_name":"All Variables","variable_group_description":"All variables within the group","variable":[{"variable_id":"TX","variable_name":"Treatment group","variable_type":"categorical","variable_description":"Treatment group","data_hierarchy":"biolincc_camp/Treatment group","derived_variable_level_data":[{}]},{"variable_id":"TG","variable_name":"Treatment group","variable_type":"categorical","variable_description":"Treatment group","data_hierarchy":"biolincc_camp/Treatment group","derived_variable_level_data":[{}]},{"variable_id":"ID","variable_name":"Randomized participant ID","variable_type":"continuous","variable_description":"Randomized participant ID","data_hierarchy":"biolincc_camp/Randomized participant ID","derived_variable_level_data":[{}]},{"variable_id":"AGE_RZ","variable_name":"Age in years at Randomization ","variable_type":"continuous","variable_description":"Age in years at Randomization ","data_hierarchy":"biolincc_camp/Age in years at Randomization ","derived_variable_level_data":[{}]},{"variable_id":"GENDER","variable_name":"Gender","variable_type":"categorical","variable_description":"Gender","data_hierarchy":"biolincc_camp/Gender","derived_variable_level_data":[{}]},{"variable_id":"ETHNIC","variable_name":"Ethnicity","variable_type":"categorical","variable_description":"Ethnicity","data_hierarchy":"biolincc_camp/Ethnicity","derived_variable_level_data":[{}]},{"variable_id":"HEMOG","variable_name":"Hemoglobin (g/dl)","variable_type":"continuous","variable_description":"Hemoglobin (g/dl)","data_hierarchy":"biolincc_camp/Hemoglobin (g-dl)","derived_variable_level_data":[{}]},{"variable_id":"PREFEV","variable_name":"PreBD FEV1","variable_type":"continuous","variable_description":"PreBD FEV1","data_hierarchy":"biolincc_camp/PreBD FEV1","derived_variable_level_data":[{}]},{"variable_id":"PREFVC","variable_name":"PreBD FVC","variable_type":"continuous","variable_description":"PreBD FVC","data_hierarchy":"biolincc_camp/PreBD FVC","derived_variable_level_data":[{}]},{"variable_id":"PREFF","variable_name":"PreBD FEV1/FVC ratio %","variable_type":"continuous","variable_description":"PreBD FEV1/FVC ratio %","data_hierarchy":"biolincc_camp/PreBD FEV1-FVC ratio %","derived_variable_level_data":[{}]},{"variable_id":"PREPF","variable_name":"PreBD peak flow","variable_type":"continuous","variable_description":"PreBD peak flow","data_hierarchy":"biolincc_camp/PreBD peak flow","derived_variable_level_data":[{}]},{"variable_id":"POSFEV","variable_name":"PostBD FEV1","variable_type":"continuous","variable_description":"PostBD FEV1","data_hierarchy":"biolincc_camp/PostBD FEV1","derived_variable_level_data":[{}]},{"variable_id":"POSFVC","variable_name":"PostBD FVC","variable_type":"continuous","variable_description":"PostBD FVC","data_hierarchy":"biolincc_camp/PostBD FVC","derived_variable_level_data":[{}]},{"variable_id":"POSFF","variable_name":"PostBD FEV1/FVC ratio %","variable_type":"continuous","variable_description":"PostBD FEV1/FVC ratio %","data_hierarchy":"biolincc_camp/PostBD FEV1-FVC ratio %","derived_variable_level_data":[{}]},{"variable_id":"POSPF","variable_name":"PostBD peak flow","variable_type":"continuous","variable_description":"PostBD peak flow","data_hierarchy":"biolincc_camp/PostBD peak flow","derived_variable_level_data":[{}]},{"variable_id":"PREFEVPP","variable_name":"PreBD FEV1 %pred","variable_type":"continuous","variable_description":"PreBD FEV1 %pred","data_hierarchy":"biolincc_camp/PreBD FEV1 %pred","derived_variable_level_data":[{}]},{"variable_id":"PREFVCPP","variable_name":"PreBD FVC %pred","variable_type":"continuous","variable_description":"PreBD FVC %pred","data_hierarchy":"biolincc_camp/PreBD FVC %pred","derived_variable_level_data":[{}]},{"variable_id":"POSFEVPP","variable_name":"PostBD FEV1 %pred","variable_type":"continuous","variable_description":"PostBD FEV1 %pred","data_hierarchy":"biolincc_camp/PostBD FEV1 %pred","derived_variable_level_data":[{}]},{"variable_id":"POSFVCPP","variable_name":"PostBD FVC %pred","variable_type":"continuous","variable_description":"PostBD FVC %pred","data_hierarchy":"biolincc_camp/PostBD FVC %pred","derived_variable_level_data":[{}]},{"variable_id":"WBC","variable_name":"White Blood Cell count (1000 cells/ul)","variable_type":"continuous","variable_description":"White Blood Cell count (1000 cells/ul)","data_hierarchy":"biolincc_camp/White Blood Cell count (1000 cells-ul)","derived_variable_level_data":[{}]},{"variable_id":"AGEHOME","variable_name":"Age of current home (years)","variable_type":"continuous","variable_description":"Age of current home (years)","data_hierarchy":"biolincc_camp/Age of current home (years)","derived_variable_level_data":[{}]},{"variable_id":"ANYPET","variable_name":"Any pets","variable_type":"continuous","variable_description":"Any pets","data_hierarchy":"biolincc_camp/Any pets","derived_variable_level_data":[{}]},{"variable_id":"WOODSTOVE","variable_name":"Used wood stove for heating/cooking","variable_type":"continuous","variable_description":"Used wood stove for heating/cooking","data_hierarchy":"biolincc_camp/Used wood stove for heating-cooking","derived_variable_level_data":[{}]},{"variable_id":"DEHUMID","variable_name":"Use a dehumidifier","variable_type":"continuous","variable_description":"Use a dehumidifier","data_hierarchy":"biolincc_camp/Use a dehumidifier","derived_variable_level_data":[{}]},{"variable_id":"PARENT_SMOKES","variable_name":"Either Parent/partner smokes in home","variable_type":"continuous","variable_description":"Either Parent/partner smokes in home","data_hierarchy":"biolincc_camp/Either Parent-partner smokes in home","derived_variable_level_data":[{}]},{"variable_id":"ANY_SMOKES","variable_name":"Anyone (including visitors) smokes in home","variable_type":"continuous","variable_description":"Anyone (including visitors) smokes in home","data_hierarchy":"biolincc_camp/Anyone (including visitors) smokes in home","derived_variable_level_data":[{}]},{"variable_id":"VISITC","variable_name":"Followup Visit (mos)","variable_type":"categorical","variable_description":"Followup Visit (mos)","data_hierarchy":"biolincc_camp/Followup Visit (mos)","derived_variable_level_data":[{}]},{"variable_id":"FDAYS ","variable_name":"Days since randomization ","variable_type":"continuous","variable_description":"Days since randomization ","data_hierarchy":"biolincc_camp/Days since randomization ","derived_variable_level_data":[{}]}]}]}]}]}]
