[{"study_name":"RAS Test Studies BDC Dummy Data","study":"RAS_TEST","study_phs_number":"RAS_TEST","study_url":"https://www.ncbi.nlm.nih.gov/projects/gap/cgi-bin/study.cgi?study_id=RAS_TEST.v1.p1","form_group":[{"form_group":"N/A","form":[{"form":"pht000001","form_description":"N/A","form_name":"Test the user has access to only one study","variable_group":[{"variable_group_name":"NA","variable_group_description":"N/A","variable":[{"variable_id":"PHV00000001","variable_name":"Only one study sex","variable_type":"N/A","variable_description":"Testing 1 2","data_hierarchy":"RAS_TEST/Test the user has access to only one study/Only one study sex","derived_variable_level_data":[{"concept_path":"/phs002409/pht000001/phv00000001"}]}]}]},{"form":"pht000002","form_description":"N/A","form_name":"Test the user has access to consent 2 and consent 3. Test the user does not have access to consent 1.","variable_group":[{"variable_group_name":"NA","variable_group_description":"N/A","variable":[{"variable_id":"PHV00000002","variable_name":"Age","variable_type":"N/A","variable_description":"Please work","data_hierarchy":"RAS_TEST/Test the user has access to consent 2 and consent 3. Test the user does not have access to consent 1./Age","derived_variable_level_data":[{"concept_path":"/phs002410/pht000002/phv00000002"}]}]}]},{"form":"pht000003","form_description":"N/A","form_name":"Test the user has access to phs000710.v1.p1.c99 and phs002410.v1.p1.c1","variable_group":[{"variable_group_name":"NA","variable_group_description":"N/A","variable":[{"variable_id":"PHV00000003","variable_name":"Heart disease","variable_type":"N/A","variable_description":"I hope I don't die","data_hierarchy":"RAS_TEST/Test the user has access to phs000710.v1.p1.c99 and phs002410.v1.p1.c1/Heart disease","derived_variable_level_data":[{"concept_path":"/phs000710/pht000003/phv00000003"}]}]}]},{"form":"pht000004","form_description":"N/A","form_name":"Test the user has access Test exchange area c999","variable_group":[{"variable_group_name":"NA","variable_group_description":"N/A","variable":[{"variable_id":"PHV00000004","variable_name":"BMI","variable_type":"N/A","variable_description":"BMMIIIIIIIIIIIIII","data_hierarchy":"RAS_TEST/Test the user has access Test exchange area c999/BMI","derived_variable_level_data":[{"concept_path":"/phs000710/pht000004/phv00000004"}]}]}]},{"form":"pht000005","form_description":"N/A","form_name":"Test the user has access to phs002084.v2.p1.c1 and phs002085.v1.p1.c1. Test the user does not have access to phs002086.v1.p1","variable_group":[{"variable_group_name":"NA","variable_group_description":"N/A","variable":[{"variable_id":"PHV00000005","variable_name":"Happy and you know it","variable_type":"N/A","variable_description":"so happy","data_hierarchy":"RAS_TEST/Test the user has access to phs002084.v2.p1.c1 and phs002085.v1.p1.c1. Test the user does not have access to phs002086.v1.p1/Happy and you know it","derived_variable_level_data":[{"concept_path":"/phs002084/pht000005/phv00000005"}]}]}]},{"form":"pht000006","form_description":"N/A","form_name":"Test the user has access to phs002084.v2.p1.c1 and phs002085.v1.p1.c1. Test the user does not have access to phs002086.v1.p1","variable_group":[{"variable_group_name":"NA","variable_group_description":"N/A","variable":[{"variable_id":"PHV00000006","variable_name":"Love testing","variable_type":"N/A","variable_description":"I want to date testing","data_hierarchy":"RAS_TEST/Test the user has access to phs002084.v2.p1.c1 and phs002085.v1.p1.c1. Test the user does not have access to phs002086.v1.p1/Love testing","derived_variable_level_data":[{"concept_path":"/phs002085/pht000006/phv00000006"}]}]}]},{"form":"pht000007","form_description":"N/A","form_name":"Test the user access to phs002086.v1.p1","variable_group":[{"variable_group_name":"NA","variable_group_description":"N/A","variable":[{"variable_id":"PHV00000007","variable_name":"Rating","variable_type":"N/A","variable_description":"Rating of how much fun I am having","data_hierarchy":"RAS_TEST/Test the user access to phs002086.v1.p1/Rating","derived_variable_level_data":[{"concept_path":"/phs002086/pht000007/phv00000007"}]}]}]},{"form":"demographic","form_description":"N/A","form_name":"Harmonized tests I hope they pass","variable_group":[{"variable_group_name":"NA","variable_group_description":"N/A","variable":[{"variable_id":"ANNOTATED_SEX_1","variable_name":"annotated_sex_1","variable_type":"N/A","variable_description":"Subject sex, as recorded by the study.","data_hierarchy":"RAS_TEST/Harmonized tests I hope they pass/annotated_sex_1","derived_variable_level_data":[{"concept_path":"/DCC Harmonized data set/demographic/annotated_sex_1/"}]},{"variable_id":"SMOKER","variable_name":"smoker","variable_type":"N/A","variable_description":"Does the patient smoke public dataset","data_hierarchy":"RAS_TEST/Public dataset I hope they pass/smoker","derived_variable_level_data":[{"concept_path":"/open_access-NHANES/demographic/smoker"}]}]},{"variable_group_name":"NA","variable_group_description":"N/A","variable":[{"variable_id":"ANNOTATED_SEX_1","variable_name":"annotated_sex_1","variable_type":"N/A","variable_description":"Subject sex, as recorded by the study.","data_hierarchy":"RAS_TEST/Harmonized tests I hope they pass/annotated_sex_1","derived_variable_level_data":[{"concept_path":"/DCC Harmonized data set/demographic/annotated_sex_1/"}]},{"variable_id":"SMOKER","variable_name":"smoker","variable_type":"N/A","variable_description":"Does the patient smoke public dataset","data_hierarchy":"RAS_TEST/Public dataset I hope they pass/smoker","derived_variable_level_data":[{"concept_path":"/open_access-NHANES/demographic/smoker"}]}]}]},{"form":"demographic","form_description":"N/A","form_name":"Public dataset I hope they pass","variable_group":[{"variable_group_name":"NA","variable_group_description":"N/A","variable":[{"variable_id":"ANNOTATED_SEX_1","variable_name":"annotated_sex_1","variable_type":"N/A","variable_description":"Subject sex, as recorded by the study.","data_hierarchy":"RAS_TEST/Harmonized tests I hope they pass/annotated_sex_1","derived_variable_level_data":[{"concept_path":"/DCC Harmonized data set/demographic/annotated_sex_1/"}]},{"variable_id":"SMOKER","variable_name":"smoker","variable_type":"N/A","variable_description":"Does the patient smoke public dataset","data_hierarchy":"RAS_TEST/Public dataset I hope they pass/smoker","derived_variable_level_data":[{"concept_path":"/open_access-NHANES/demographic/smoker"}]}]},{"variable_group_name":"NA","variable_group_description":"N/A","variable":[{"variable_id":"ANNOTATED_SEX_1","variable_name":"annotated_sex_1","variable_type":"N/A","variable_description":"Subject sex, as recorded by the study.","data_hierarchy":"RAS_TEST/Harmonized tests I hope they pass/annotated_sex_1","derived_variable_level_data":[{"concept_path":"/DCC Harmonized data set/demographic/annotated_sex_1/"}]},{"variable_id":"SMOKER","variable_name":"smoker","variable_type":"N/A","variable_description":"Does the patient smoke public dataset","data_hierarchy":"RAS_TEST/Public dataset I hope they pass/smoker","derived_variable_level_data":[{"concept_path":"/open_access-NHANES/demographic/smoker"}]}]}]}]}]}]
