[{"study_name":"Multi-Ethnic Study of Atherosclerosis (Echocardiogram Image Repository)","study":"Imaging_MESA_ECHO","study_phs_number":"phs003702","study_url":"https://www.ncbi.nlm.nih.gov/projects/gap/cgi-bin/study.cgi?study_id=phs003702.v1.p1","form_group":[{"form_group":"NA","form":[{"form":"NA","form_description":"NA","form_name":"NA","variable_group":[{"variable_group_name":"NA","variable_group_description":"NA","variable":[{"variable_id":"ID","variable_name":"De-identified patient number","variable_type":"integer","variable_description":"De-identified patient number","data_hierarchy":"Imaging_MESA_ECHO/NA/De-identified patient number","drs_uri":"NA","derived_variable_level_data":[{}]},{"variable_id":"VISITNN","variable_name":"VisitNumber","variable_type":"integer","variable_description":"VisitNumber","data_hierarchy":"Imaging_MESA_ECHO/NA/VisitNumber","drs_uri":"NA","derived_variable_level_data":[{}]},{"variable_id":"YYYMMDD","variable_name":"Date de-identified by aggregating to the year","variable_type":"integer","variable_description":"Date de-identified by aggregating to the year","data_hierarchy":"Imaging_MESA_ECHO/NA/Date de-identified by aggregating to the year","drs_uri":"NA","derived_variable_level_data":[{}]},{"variable_id":"SEQ","variable_name":"Sequence number to ensure filename is unique","variable_type":"integer","variable_description":"Sequence number to ensure filename is unique","data_hierarchy":"Imaging_MESA_ECHO/NA/Sequence number to ensure filename is unique","drs_uri":"NA","derived_variable_level_data":[{}]}]}]}]}]}]
