[{"study_name":"IGSR: The International Genome Sample Resource","study":"1000Genomes","study_phs_number":"open_access-1000genomes","study_url":"https://www.ncbi.nlm.nih.gov/projects/gap/cgi-bin/study.cgi?study_id=open_access-1000genomes.v1.p1","form_group":[{"form_group":"N/A","form":[{"form":"IGSR Samples","form_description":"N/A","form_name":"IGSR Samples","variable_group":[{"variable_group_name":"NA","variable_group_description":"N/A","variable":[{"variable_id":"SAMPLE NAME","variable_name":"Sample Name","variable_type":"Categorical","variable_description":"Sample Name","data_hierarchy":"1000Genomes//IGSR Samples/Sample Name","derived_variable_level_data":[{}]},{"variable_id":"SEX","variable_name":"Sex","variable_type":"Categorical","variable_description":"Sex","data_hierarchy":"1000Genomes//IGSR Samples/Sex","derived_variable_level_data":[{}]},{"variable_id":"BIOSAMPLE ID","variable_name":"Biosample ID","variable_type":"Categorical","variable_description":"Biosample ID","data_hierarchy":"1000Genomes//IGSR Samples/Biosample ID","derived_variable_level_data":[{}]},{"variable_id":"POPULATION CODE","variable_name":"Population Code","variable_type":"Categorical","variable_description":"Population Code","data_hierarchy":"1000Genomes//IGSR Samples/Population Code","derived_variable_level_data":[{}]},{"variable_id":"POPULATION NAME","variable_name":"Population Name","variable_type":"Categorical","variable_description":"Population Name","data_hierarchy":"1000Genomes//IGSR Samples/Population Name","derived_variable_level_data":[{}]},{"variable_id":"SUPERPOPULATION CODE","variable_name":"Superpopulation Code","variable_type":"Categorical","variable_description":"Superpopulation Code","data_hierarchy":"1000Genomes//IGSR Samples/Superpopulation Code","derived_variable_level_data":[{}]},{"variable_id":"SUPERPOPULATION NAME","variable_name":"Superpopulation Name","variable_type":"Categorical","variable_description":"Superpopulation Name","data_hierarchy":"1000Genomes//IGSR Samples/Superpopulation Name","derived_variable_level_data":[{}]},{"variable_id":"POPULATION ELASTIC ID","variable_name":"Population Elastic ID","variable_type":"Categorical","variable_description":"Population Elastic ID","data_hierarchy":"1000Genomes//IGSR Samples/Population Elastic ID","derived_variable_level_data":[{}]},{"variable_id":"DATA COLLECTIONS","variable_name":"Data Collections","variable_type":"Categorical","variable_description":"Data Collections","data_hierarchy":"1000Genomes//IGSR Samples/Data Collections","derived_variable_level_data":[{}]},{"variable_id":"1000 GENOMES 30X ON GRCH38","variable_name":"1000 GENOMES 30X ON GRCH38","variable_type":"Categorical","variable_description":"1000 GENOMES 30X ON GRCH38","data_hierarchy":"1000Genomes//IGSR Samples/1000 GENOMES 30X ON GRCH38","derived_variable_level_data":[{}]},{"variable_id":"HUMAN GENOME STRUCTURAL VARIATION CONSORTIUM, PHASE 21000","variable_name":"HUMAN GENOME STRUCTURAL VARIATION CONSORTIUM, PHASE 21000","variable_type":"Categorical","variable_description":"HUMAN GENOME STRUCTURAL VARIATION CONSORTIUM, PHASE 21000","data_hierarchy":"1000Genomes//IGSR Samples/HUMAN GENOME STRUCTURAL VARIATION CONSORTIUM, PHASE 21000","derived_variable_level_data":[{}]},{"variable_id":"GENOMES ON GRCH381000","variable_name":"GENOMES ON GRCH381000","variable_type":"Categorical","variable_description":"GENOMES ON GRCH381000","data_hierarchy":"1000Genomes//IGSR Samples/GENOMES ON GRCH381000","derived_variable_level_data":[{}]},{"variable_id":"GENOMES PHASE 3 RELEASE","variable_name":"GENOMES PHASE 3 RELEASE","variable_type":"Categorical","variable_description":"GENOMES PHASE 3 RELEASE","data_hierarchy":"1000Genomes//IGSR Samples/GENOMES PHASE 3 RELEASE","derived_variable_level_data":[{}]},{"variable_id":"1000 GENOMES PHASE 1 RELEASE","variable_name":"1000 GENOMES PHASE 1 RELEASE","variable_type":"Categorical","variable_description":"1000 GENOMES PHASE 1 RELEASE","data_hierarchy":"1000Genomes//IGSR Samples/1000 GENOMES PHASE 1 RELEASE","derived_variable_level_data":[{}]},{"variable_id":"THE HUMAN GENOME STRUCTURAL VARIATION CONSORTIUM","variable_name":"THE HUMAN GENOME STRUCTURAL VARIATION CONSORTIUM","variable_type":"Categorical","variable_description":"THE HUMAN GENOME STRUCTURAL VARIATION CONSORTIUM","data_hierarchy":"1000Genomes//IGSR Samples/THE HUMAN GENOME STRUCTURAL VARIATION CONSORTIUM","derived_variable_level_data":[{}]},{"variable_id":"HUMAN GENOME DIVERSITY PROJECT","variable_name":"HUMAN GENOME DIVERSITY PROJECT","variable_type":"Categorical","variable_description":"HUMAN GENOME DIVERSITY PROJECT","data_hierarchy":"1000Genomes//IGSR Samples/HUMAN GENOME DIVERSITY PROJECT","derived_variable_level_data":[{}]},{"variable_id":"SIMONS GENOME DIVERSITY PROJECT","variable_name":"SIMONS GENOME DIVERSITY PROJECT","variable_type":"Categorical","variable_description":"SIMONS GENOME DIVERSITY PROJECT","data_hierarchy":"1000Genomes//IGSR Samples/SIMONS GENOME DIVERSITY PROJECT","derived_variable_level_data":[{}]},{"variable_id":"GAMBIAN GENOME VARIATION PROJECT (GRCH38)","variable_name":"GAMBIAN GENOME VARIATION PROJECT (GRCH38)","variable_type":"Categorical","variable_description":"GAMBIAN GENOME VARIATION PROJECT (GRCH38)","data_hierarchy":"1000Genomes//IGSR Samples/GAMBIAN GENOME VARIATION PROJECT (GRCH38)","derived_variable_level_data":[{}]},{"variable_id":"GAMBIAN GENOME VARIATION PROJECT (GRCH37)","variable_name":"GAMBIAN GENOME VARIATION PROJECT (GRCH37)","variable_type":"Categorical","variable_description":"GAMBIAN GENOME VARIATION PROJECT (GRCH37)","data_hierarchy":"1000Genomes//IGSR Samples/GAMBIAN GENOME VARIATION PROJECT (GRCH37)","derived_variable_level_data":[{}]},{"variable_id":"GEUVADIS","variable_name":"GEUVADIS","variable_type":"Categorical","variable_description":"GEUVADIS","data_hierarchy":"1000Genomes//IGSR Samples/GEUVADIS","derived_variable_level_data":[{}]},{"variable_id":"ILLUMINA PLATINUM PEDIGREE","variable_name":"ILLUMINA PLATINUM PEDIGREE","variable_type":"Categorical","variable_description":"ILLUMINA PLATINUM PEDIGREE","data_hierarchy":"1000Genomes//IGSR Samples/ILLUMINA PLATINUM PEDIGREE","derived_variable_level_data":[{}]},{"variable_id":"90 HAN CHINESE HIGH COVERAGE GENOMES","variable_name":"90 HAN CHINESE HIGH COVERAGE GENOMES","variable_type":"Categorical","variable_description":"90 HAN CHINESE HIGH COVERAGE GENOMES","data_hierarchy":"1000Genomes//IGSR Samples/90 HAN CHINESE HIGH COVERAGE GENOMES","derived_variable_level_data":[{}]},{"variable_id":"HGDP TRANSCRIPTOME","variable_name":"HGDP TRANSCRIPTOME","variable_type":"Categorical","variable_description":"HGDP TRANSCRIPTOME","data_hierarchy":"1000Genomes//IGSR Samples/HGDP TRANSCRIPTOME","derived_variable_level_data":[{}]},{"variable_id":"HUMAN GENOME STRUCTURAL VARIATION CONSORTIUM, PHASE 3","variable_name":"HUMAN GENOME STRUCTURAL VARIATION CONSORTIUM, PHASE 3","variable_type":"Categorical","variable_description":"HUMAN GENOME STRUCTURAL VARIATION CONSORTIUM, PHASE 3","data_hierarchy":"1000Genomes//IGSR Samples/HUMAN GENOME STRUCTURAL VARIATION CONSORTIUM, PHASE 3","derived_variable_level_data":[{}]}]}]},{"form":"Synthetic Phenotypic Data","form_description":"N/A","form_name":"Synthetic Phenotypic Data","variable_group":[{"variable_group_name":"NA","variable_group_description":"N/A","variable":[{"variable_id":"SYNTHETIC_STUDY","variable_name":"Synthetic Variable : Study","variable_type":"Categorical","variable_description":"Synthetic Variable : Study","data_hierarchy":"1000Genomes//Synthetic Phenotypic Data/Synthetic Variable : Study","derived_variable_level_data":[{}]},{"variable_id":"SYNTHETIC_SEX","variable_name":"Synthetic Variable : Sex","variable_type":"Categorical","variable_description":"Synthetic Variable : Sex","data_hierarchy":"1000Genomes//Synthetic Phenotypic Data/Synthetic Variable : Sex","derived_variable_level_data":[{}]},{"variable_id":"SYNTHETIC_AGE","variable_name":"Synthetic Variable : Age","variable_type":"Continuous","variable_description":"Synthetic Variable : Age","data_hierarchy":"1000Genomes//Synthetic Phenotypic Data/Synthetic Variable : Age","derived_variable_level_data":[{}]},{"variable_id":"SYNTHETIC_HEIGHT","variable_name":"Synthetic Variable : Height","variable_type":"Continuous","variable_description":"Synthetic Variable : Height","data_hierarchy":"1000Genomes//Synthetic Phenotypic Data/Synthetic Variable : Height","derived_variable_level_data":[{}]},{"variable_id":"SYNTHETIC_STATUS","variable_name":"Synthetic Variable : Status","variable_type":"Categorical","variable_description":"Synthetic Variable : Status","data_hierarchy":"1000Genomes//Synthetic Phenotypic Data/Synthetic Variable : Status","derived_variable_level_data":[{}]}]}]}]}]}]
