[{"study_name":"LungMAP: Molecular Atlas of Lung Development - Human Lung Tissue","study":"LungMAP-MALD","study_phs_number":"phs001961","study_url":"https://www.ncbi.nlm.nih.gov/projects/gap/cgi-bin/study.cgi?study_id=phs001961.v2.p1","form_group":[{"form_group":"All forms within the study","form":[{"form":"Sample","form_description":"Form description not provided","form_name":"Sample","variable_group":[{"variable_group_name":"All variables","variable_group_description":"All variables","variable":[{"variable_id":"SUBJECT_ID","variable_name":"SUBJECT_ID","variable_type":"N/A","variable_description":"SUBJECT_ID","data_hierarchy":"LungMAP: MALD/Sample/SUBJECT_ID","derived_variable_level_data":[{}]},{"variable_id":"TYPE","variable_name":"TYPE","variable_type":"N/A","variable_description":"TYPE","data_hierarchy":"LungMAP: MALD/Sample/TYPE","derived_variable_level_data":[{}]},{"variable_id":"PROJECT_ID","variable_name":"PROJECT_ID","variable_type":"N/A","variable_description":"PROJECT_ID","data_hierarchy":"LungMAP: MALD/Sample/PROJECT_ID","derived_variable_level_data":[{}]},{"variable_id":"SUBMITTER_ID","variable_name":"SUBMITTER_ID","variable_type":"N/A","variable_description":"SUBMITTER_ID","data_hierarchy":"LungMAP: MALD/Sample/SUBMITTER_ID","derived_variable_level_data":[{}]},{"variable_id":"SUBJECTS.SUBMITTER_ID","variable_name":"SUBJECTS.SUBMITTER_ID","variable_type":"N/A","variable_description":"SUBJECTS.SUBMITTER_ID","data_hierarchy":"LungMAP: MALD/Sample/SUBJECTS.SUBMITTER_ID","derived_variable_level_data":[{}]},{"variable_id":"BIOSPECIMEN_ANATOMIC_SITE_UBERON_ID","variable_name":"BIOSPECIMEN_ANATOMIC_SITE_UBERON_ID","variable_type":"N/A","variable_description":"BIOSPECIMEN_ANATOMIC_SITE_UBERON_ID","data_hierarchy":"LungMAP: MALD/Sample/BIOSPECIMEN_ANATOMIC_SITE_UBERON_ID","derived_variable_level_data":[{}]},{"variable_id":"BIOSPECIMEN_ANATOMIC_SITE_UBERON_TERM","variable_name":"BIOSPECIMEN_ANATOMIC_SITE_UBERON_TERM","variable_type":"N/A","variable_description":"BIOSPECIMEN_ANATOMIC_SITE_UBERON_TERM","data_hierarchy":"LungMAP: MALD/Sample/BIOSPECIMEN_ANATOMIC_SITE_UBERON_TERM","derived_variable_level_data":[{}]},{"variable_id":"BIOSPECIMEN_PHYSICAL_SITE","variable_name":"BIOSPECIMEN_PHYSICAL_SITE","variable_type":"N/A","variable_description":"BIOSPECIMEN_PHYSICAL_SITE","data_hierarchy":"LungMAP: MALD/Sample/BIOSPECIMEN_PHYSICAL_SITE","derived_variable_level_data":[{}]},{"variable_id":"BIOSPECIMEN_TYPE","variable_name":"BIOSPECIMEN_TYPE","variable_type":"N/A","variable_description":"BIOSPECIMEN_TYPE","data_hierarchy":"LungMAP: MALD/Sample/BIOSPECIMEN_TYPE","derived_variable_level_data":[{}]},{"variable_id":"IS_FFPE","variable_name":"IS_FFPE","variable_type":"N/A","variable_description":"IS_FFPE","data_hierarchy":"LungMAP: MALD/Sample/IS_FFPE","derived_variable_level_data":[{}]},{"variable_id":"SPECIMEN_ID","variable_name":"SPECIMEN_ID","variable_type":"N/A","variable_description":"SPECIMEN_ID","data_hierarchy":"LungMAP: MALD/Sample/SPECIMEN_ID","derived_variable_level_data":[{}]},{"variable_id":"TISSUE_TYPE","variable_name":"TISSUE_TYPE","variable_type":"N/A","variable_description":"TISSUE_TYPE","data_hierarchy":"LungMAP: MALD/Sample/TISSUE_TYPE","derived_variable_level_data":[{}]}]}]},{"form":"Demographics","form_description":"Form description not provided","form_name":"Demographics","variable_group":[{"variable_group_name":"All variables","variable_group_description":"All variables","variable":[{"variable_id":"SUBJECT_ID","variable_name":"SUBJECT_ID","variable_type":"N/A","variable_description":"SUBJECT_ID","data_hierarchy":"LungMAP: MALD/Demographics/SUBJECT_ID","derived_variable_level_data":[{}]},{"variable_id":"TYPE","variable_name":"TYPE","variable_type":"N/A","variable_description":"TYPE","data_hierarchy":"LungMAP: MALD/Demographics/TYPE","derived_variable_level_data":[{}]},{"variable_id":"PROJECT_ID","variable_name":"PROJECT_ID","variable_type":"N/A","variable_description":"PROJECT_ID","data_hierarchy":"LungMAP: MALD/Demographics/PROJECT_ID","derived_variable_level_data":[{}]},{"variable_id":"SUBMITTER_ID","variable_name":"SUBMITTER_ID","variable_type":"N/A","variable_description":"SUBMITTER_ID","data_hierarchy":"LungMAP: MALD/Demographics/SUBMITTER_ID","derived_variable_level_data":[{}]},{"variable_id":"SUBJECTS.SUBMITTER_ID","variable_name":"SUBJECTS.SUBMITTER_ID","variable_type":"N/A","variable_description":"SUBJECTS.SUBMITTER_ID","data_hierarchy":"LungMAP: MALD/Demographics/SUBJECTS.SUBMITTER_ID","derived_variable_level_data":[{}]},{"variable_id":"AGE_AT_WEIGHT_BASELINE","variable_name":"AGE_AT_WEIGHT_BASELINE","variable_type":"N/A","variable_description":"AGE_AT_WEIGHT_BASELINE","data_hierarchy":"LungMAP: MALD/Demographics/AGE_AT_WEIGHT_BASELINE","derived_variable_level_data":[{}]},{"variable_id":"ANNOTATED_SEX","variable_name":"ANNOTATED_SEX","variable_type":"N/A","variable_description":"ANNOTATED_SEX","data_hierarchy":"LungMAP: MALD/Demographics/ANNOTATED_SEX","derived_variable_level_data":[{}]},{"variable_id":"BMI_BASELINE","variable_name":"BMI_BASELINE","variable_type":"N/A","variable_description":"BMI_BASELINE","data_hierarchy":"LungMAP: MALD/Demographics/BMI_BASELINE","derived_variable_level_data":[{}]},{"variable_id":"ETHNICITY","variable_name":"ETHNICITY","variable_type":"N/A","variable_description":"ETHNICITY","data_hierarchy":"LungMAP: MALD/Demographics/ETHNICITY","derived_variable_level_data":[{}]},{"variable_id":"HEIGHT_BASELINE","variable_name":"HEIGHT_BASELINE","variable_type":"N/A","variable_description":"HEIGHT_BASELINE","data_hierarchy":"LungMAP: MALD/Demographics/HEIGHT_BASELINE","derived_variable_level_data":[{}]},{"variable_id":"UNIT_HEIGHT_BASELINE","variable_name":"UNIT_HEIGHT_BASELINE","variable_type":"N/A","variable_description":"UNIT_HEIGHT_BASELINE","data_hierarchy":"LungMAP: MALD/Demographics/UNIT_HEIGHT_BASELINE","derived_variable_level_data":[{}]},{"variable_id":"UNIT_WEIGHT_BASELINE","variable_name":"UNIT_WEIGHT_BASELINE","variable_type":"N/A","variable_description":"UNIT_WEIGHT_BASELINE","data_hierarchy":"LungMAP: MALD/Demographics/UNIT_WEIGHT_BASELINE","derived_variable_level_data":[{}]},{"variable_id":"WEIGHT","variable_name":"WEIGHT","variable_type":"N/A","variable_description":"WEIGHT","data_hierarchy":"LungMAP: MALD/Demographics/WEIGHT","derived_variable_level_data":[{}]},{"variable_id":"WEIGHT_BASELINE","variable_name":"WEIGHT_BASELINE","variable_type":"N/A","variable_description":"WEIGHT_BASELINE","data_hierarchy":"LungMAP: MALD/Demographics/WEIGHT_BASELINE","derived_variable_level_data":[{}]}]}]}]}]}]
