[{"study_name":"Action to Control Cardiovascular Risk in Diabetes (ACCORD-BioLINCC)","study":"BL_ACCORD","study_phs_number":"phs003551","study_url":"https://www.ncbi.nlm.nih.gov/projects/gap/cgi-bin/study.cgi?study_id=phs003551.v1.p1","form_group":[{"form_group":"N/A","form":[{"form":"CVDOUTCOMES","form_description":"N/A","form_name":"CVDOUTCOMES","variable_group":[{"variable_group_name":"NA","variable_group_description":"N/A","variable":[{"variable_id":"CENSOR_MSD","variable_name":"MI, Stroke or Any Death censoring flag (0=event, 1=censored)","variable_type":"num","variable_description":"MI, Stroke or Any Death censoring flag (0=event, 1=censored)","data_hierarchy":"BL_ACCORD/CVDOUTCOMES/MI, Stroke or Any Death censoring flag (0=event, 1=censored)","derived_variable_level_data":[{}]},{"variable_id":"FUYRS_MSD","variable_name":"MI, Stroke or Any Death Follow-up time (years)","variable_type":"num","variable_description":"MI, Stroke or Any Death Follow-up time (years)","data_hierarchy":"BL_ACCORD/CVDOUTCOMES/MI, Stroke or Any Death Follow-up time (years)","derived_variable_level_data":[{}]}]}]},{"form":"CONCOMITANTMEDS","form_description":"N/A","form_name":"CONCOMITANTMEDS","variable_group":[{"variable_group_name":"NA","variable_group_description":"N/A","variable":[{"variable_id":"DAYS_FROM_BASELINE","variable_name":"Study Days: number of days following randomization","variable_type":"num","variable_description":"Study Days: number of days following randomization","data_hierarchy":"BL_ACCORD/CONCOMITANTMEDS/Study Days: number of days following randomization","derived_variable_level_data":[{}]}]}]},{"form":"EYE","form_description":"N/A","form_name":"EYE","variable_group":[{"variable_group_name":"NA","variable_group_description":"N/A","variable":[{"variable_id":"ETDRS8","variable_name":"8 Yrs - Early treatment: Diabetic Retinopathy Photograph Grading","variable_type":"num","variable_description":"8 Yrs - Early treatment: Diabetic Retinopathy Photograph Grading","data_hierarchy":"BL_ACCORD/EYE/8 Yrs - Early treatment: Diabetic Retinopathy Photograph Grading","derived_variable_level_data":[{}]},{"variable_id":"EVENT_8","variable_name":"ACCORDION (8 Yrs follow-up): Eye Event (0=No, 1=Yes)","variable_type":"num","variable_description":"ACCORDION (8 Yrs follow-up): Eye Event (0=No, 1=Yes)","data_hierarchy":"BL_ACCORD/EYE/ACCORDION (8 Yrs follow-up): Eye Event (0=No, 1=Yes)","derived_variable_level_data":[{}]}]}]},{"form":"HYPOGLYCEMIAEVENTS","form_description":"N/A","form_name":"HYPOGLYCEMIAEVENTS","variable_group":[{"variable_group_name":"NA","variable_group_description":"N/A","variable":[{"variable_id":"SEVHYPO_TOT","variable_name":"Number of hypoglycemic events requiring medical or paramedical attention","variable_type":"num","variable_description":"Number of hypoglycemic events requiring medical or paramedical attention","data_hierarchy":"BL_ACCORD/HYPOGLYCEMIAEVENTS/Number of hypoglycemic events requiring medical or paramedical attention","derived_variable_level_data":[{}]},{"variable_id":"YRSRISK_TOT","variable_name":"Time at risk (years) for hypoglycemic events","variable_type":"num","variable_description":"Time at risk (years) for hypoglycemic events","data_hierarchy":"BL_ACCORD/HYPOGLYCEMIAEVENTS/Time at risk (years) for hypoglycemic events","derived_variable_level_data":[{}]}]}]}]}]}]
